section,keywords,pattern,cta_notes
Hero,"hero,headline,value prop",Outcome headline + subcopy + primary CTA,One primary CTA; secondary ghost
Social proof,"logos,testimonial,review",Logo row + 2–3 strong quotes,Real names/roles; avoid fake density
Pricing,"pricing,plans,tiers",3 tiers max; highlight recommended,Annual toggle clear
FAQ,"faq,support",Accordion; jump links from hero objections,Keep answers scannable
Footer,"footer,legal,sitemap",Links grouped; newsletter optional,Infinite columns on mobile
